Content Title,Content Description,Content Type,Content Last Watched Date (if viewed),Content Completed At (if completed),Content Saved,Notes taken on videos (if taken),
Introduction to Terraform on Azure,"Are you wondering how to use Terraform for Azure? In this course, cloud engineer Alexandra Illarionov introduces you to everything you need to get started, including the base concepts, commands, and use-cases for Terraform in an Azure environment. Alexandra begins by defining Infrastructure as Code (IaC) and Terraform. She explains why Terraform is useful and how it compares to Bicep. Alexandra guides you through all the steps in installing and setting up Terraform in your environment, then shows you how to get started with Terraform commands, workspaces, state files, resources, and more. She steps through creating with Terraform and using Terraform to create a resource group, a virtual network, a subnet, an internal network interface, and more. After completing this course, you will know how to set up Terraform on Visual Studio Code and start deploying resources at a base level.",Course,N/A,N/A,true,N/A,
JavaScript Essential Training,"<p>JavaScript is a scripting language of the web. As the web evolves from a static to a dynamic environment, technology focus is shifting from static markup and styling to dynamic interfaces and advanced interaction. Once seen as optional, JavaScript is now becoming an integral part of the web, infusing every layer with its script.</p><p>This course includes Code Challenges powered by CoderPad. Code Challenges are interactive coding exercises with real-time feedback, so you can get hands-on coding practice alongside the course content to advance your programming skills. Instructor Morten Rand-Hendriksen helps you build your understanding of JavaScript piece by piece, from core principles like variables, data types, conditionals, and functions through advanced topics including loops, and DOM scripting. </p>",Course,2024-01-30 09:45 UTC,N/A,true,N/A,
DevOps with AWS,"DevOps describes a culture and set of processes that bring development and operations teams together to simplify software development. It allows organizations to create and improve products at a faster pace than they can deliver with traditional software development approaches. And it’s gaining in popularity at a rapid rate. In this course, programmer Dipali Kulshrestha covers the concepts of DevOps with hands-on demos to create and automate CI/CD (continuous implementation and continuous delivery) pipelines. She covers AWS services like CodeCommit, CodeBuild, CodeDeploy, and CodePipeline, and how to implement DevOps with AWS offerings to increase security, scalability, reliability, and simplicity of the development processes.",Course,N/A,N/A,true,N/A,
Microsoft Entra ID Fundamentals,"Microsoft Entra ID is Microsoft's cloud-based identity and access management service. In this beginning-level course, IT consultant and trainer Kunal D Mehta provides an introduction to Entra ID. Explore the place that Entra ID holds at the helm of all Microsoft cloud products. Learn why it’s needed today. Dive into key features that set Entra ID apart from its competitors, as well as information on the industry standards and compliance regulations it fulfills. Plus, discover the business objectives it helps achieve.",Course,2024-06-25 22:20 UTC,N/A,false,N/A,
Advanced SQL for Data Science: Time Series,"Time series data is data gathered over time: performance metrics, user interactions, and information collected by sensors. Since different time series data have different measures and different intervals,  these data present a unique challenge for data scientists. However, SQL has some features designed to help. This course teaches you how to standardize and model time series data with them. Instructor Dan Sullivan discusses windowing and the difference between sliding and tumbling window calculations. Then learn how SQL constructs such as OVER and PARTITION BY help to simplify analysis, and how denormalization can be used to augment data while avoiding joins. Plus, discover optimization techniques such as indexing. Dan also introduces time series analysis techniques such as previous time period comparisons, moving averages, exponential smoothing, and linear regression.",Course,2024-06-17 08:55 UTC,N/A,false,N/A,
CONTENT METADATA NO LONGER EXISTS - urn:li:lyndaLearningPath:1~AAAAAAd4ABI=1057003,CONTENT METADATA NO LONGER EXISTS - urn:li:lyndaLearningPath:1~AAAAAAd4ABI=1057003,Learning Path,2024-02-04 10:20 UTC,N/A,false,N/A,
CONTENT METADATA NO LONGER EXISTS - urn:li:lyndaLearningPath:1~AAAAAAd4ABI=1453627,CONTENT METADATA NO LONGER EXISTS - urn:li:lyndaLearningPath:1~AAAAAAd4ABI=1453627,Learning Path,2024-02-09 22:55 UTC,N/A,false,N/A,
Getting Started with DevOps,"DevOps is a set of practices, tools, and cultural philosophy that automate and integrate the processes between software development and IT teams. This learning path provides an overview of DevOps and the key components of the DevOps methodology.",Learning Path,2024-06-23 08:24 UTC,N/A,false,N/A,
Introducing Daily,CONTENT DESCRIPTION IS MISSING - urn:li:llsServeVideo:60347605,Video (3rd Party Provider),2024-02-02 08:05 UTC,N/A,false,N/A,
Embedding DIBs in your company culture,"Fostering diversity, inclusion, and belonging into your company culture is at the heart of a DIBs-oriented company. This video helps you foster a workplace in which diversity, inclusion, and belonging aren’t merely buzzwords but are deeply rooted in your culture and philosophy. Also, learn how to foster an environment where everyone embraces uniqueness, seeing it as a driver of innovation and not having to assimilate to fit in.",Video (3rd Party Provider),2024-02-02 08:05 UTC,N/A,false,N/A,
How community outreach plays a role in DEIB,Learn to make sure your influence extends beyond pipelines. Dr. Tana M. Session shares the importance of giving back to the communities in which organizations serve. True commitment comes from giving back. What is your organization doing to uplift underrepresented or marginalized communities?,Video (3rd Party Provider),2024-02-02 08:05 UTC,N/A,false,N/A,
Learn from your mistakes with Sarah Robb O'hagan,LEP ZINC DAILY BITE 5-Dec-203,Video (3rd Party Provider),2024-02-02 08:05 UTC,N/A,false,N/A,
Pivot data in Power Query,"Yes, it's possible to create a pivot table in Power Query. Learn about how to generate pivoted data in Power Query.",Video (3rd Party Provider),2024-02-02 08:05 UTC,N/A,false,N/A,
How to create aesthetically pleasing bar charts,"Bar charts are a useful tool and there are ways to make them less boring. In this video, learn how to articulate why bar charts work so well and explore alternatives that may be more aesthetically pleasing.",Video (3rd Party Provider),2024-02-07 06:37 UTC,2024-02-07 06:36 UTC,false,N/A,
Voluntary disability disclosures,"In this video, learn how to differentiate between inclusive disclosure and forced disclosure. This allows you to gauge how successful you are with inclusion for workers with disabilities.",Video (3rd Party Provider),2024-02-07 06:37 UTC,N/A,false,N/A,
The benefits of Microsoft Excel for agile teams,"In this video, learn how to assess whether Microsoft Excel is the best fit for your team.",Video (3rd Party Provider),2024-02-02 08:05 UTC,N/A,false,N/A,
What green jobs and skills are in demand?,"There are a set of ""green skills"" that go beyond jobs in sustainability, but are more widespread to larger workforce. Recognize that the vast majority of green skills are showing up in non-green jobs and sectors like fashion and finance.",Video (3rd Party Provider),2024-02-02 08:05 UTC,N/A,false,N/A,
Building equity into talent systems and processes,"How organizations bring DEIB into their talent practices greatly impacts whether an organization makes progress toward their DEIB goals or metrics. In this video, learn how to apply a DEIB lens to the talent lifecycle and understand the benefits.",Video (3rd Party Provider),2024-02-02 08:05 UTC,N/A,false,N/A,
SQL for Finance: Income Statement Project,"SQL is a powerful tool to have in your toolkit, when you need to create financial reports. How do you get started, though? In this course, data analytics expert Gabriela Baldivia Soncini guides you through the fundamental concepts of financial accounting via an income statement project. Learn how to extract data from a relational database, manipulate data using SQL queries, and transform the data. Find out how to prepare basic financial statements like balance sheets and income statements. Plus, solidify what you learn with a course-spanning project, as well as several hands-on challenges.",Course,2024-06-17 09:10 UTC,N/A,false,N/A,
Microsoft Azure Fundamentals (AZ-900) Cert Prep: 1 Cloud Concepts,"The Microsoft Azure Fundamentals certification exam is for anyone looking to begin their professional journey in cloud computing. To pass the AZ-900 exam, you need a high-level knowledge of the cloud, Azure architecture, core security, its basic services, management tools, and governance. This first course in the AZ-900 cert prep series covers the Cloud Concepts part of the exam objectives. Your instructor Kunal D Mehta provides a comprehensive guide toward understanding cloud computing, including the three “as-a-service” models, types of cloud configurations, and the potential benefits that organizations can get by leveraging cloud computing.",Course,2023-06-13 07:54 UTC,N/A,false,N/A,
Cloud Management with Microsoft Intune,"<p>Microsoft Endpoint Manager offers a unified management system that combines functions of Microsoft Intune and Configuration Manager to allow admins to secure, deploy, and manage users, apps, and devices. In this course, experienced networking consultant Robert McMillen explains how Endpoint Manager can be used to manage endpoint security, device management, and cloud actions. Robert begins with an overview of Endpoint products and how to identify which products are best for specific environments. Next, he explains how to prepare for, install, and use Configuration Manager. Robert goes over using Intune for managing mobile devices and links between an on-premises PC to Microsoft Entra ID (formerly Azure Active Directory). He covers assigning licenses and Group Policy, as well as Windows update policies. Robert demonstrates how to use the Intune Admin Center and Microsoft Entra ID. Plus, he introduces several Intune Suite products and highlights how to simplify and improve your Intune workflows with Windows Autopilot and Desktop Analytics.</p>",Course,2025-03-22 01:22 UTC,N/A,false,N/A,
"Build a Lightweight Full-Stack Headless CMS Using Next.js, Contentful, and GraphQL","With the growing popularity and widespread use of headless architecture in web development, it is important for web developers to stay ahead of the industry curve. Headless architecture keeps the frontend lightweight and more optimized. In this course, software engineer and educator Dakota Fabro guides you through building for clients who prefer to use a CMS with their websites so that you can provide solutions that are lightweight and intuitive. Learn to use Next.js, Contentful, and GraphQL to create a site that uses headless architecture. Then complete a final project to help you practice what you’ve learned in the course. By the end of this course, you will be able to build and maintain headless web projects, and you’ll be able to apply the skills and knowledge acquired from this course in your current or aspirational role.",Course,2024-09-08 01:17 UTC,N/A,false,N/A,
Node.js Essential Training,"Node.js is a powerful tool for controlling servers, building web applications, and creating event-driven programs. And it takes JavaScript—a language familiar to all web developers—out of the browser. With Node.js, you can build applications that run on your laptop or even the cloud.
In this course, learn the essentials of Node.js and start creating your own JavaScript applications. Instructor Eve Porcello covers all of the basics, showing how to install Node.js and work with the Node.js core, which includes standard input, standard output, the module system, the file system, and how to write and run JavaScript on the server. Upon wrapping up this course, you’ll be equipped with fundamental Node.js concepts and techniques that you can put to use in your next project.",Course,2024-03-10 06:24 UTC,2024-03-10 06:01 UTC,false,N/A,
ChatGPT's Operator: Automating Everyday Tasks with AI Agents,"Discover ChatGPT's Operator, an AI agent in research preview designed to simulate human interaction with websites for task automation. In this course, you'll explore how businesses and individuals can experiment with its capabilities, consider safety and ethical implications, and plan for integrating AI agents into workflows. Learn to evaluate potential use cases, think critically about their implementation, and prepare for the future of AI-powered automation.",Course,2025-08-10 11:42 UTC,N/A,false,N/A,
DevOps Foundations: Infrastructure as Code,"<p>Infrastructure automation—transitioning an organization's system administration from hardware into code—is one of the major DevOps practice areas. By automating configuration management, you can make your systems more reliable, processes more repeatable, and server provisioning more efficient. In this course, learn the basics of infrastructure as code, including how to keep your configuration in a source code repository and have it built and deployed just like an application.
 </p><p>
Discover how to approach converting your systems over to becoming fully automated—from server configuration to application installation to runtime orchestration. Join notable DevOps practitioners Ernest Mueller and James Wickett as they dive into key concepts, and use a wide variety of tools to illustrate those concepts, including Ansible, Terraform, Docker, Kubernetes, Serverless, and AWS Lambda. Check out this course to gain the knowledge you need to start implementing an infrastructure as code strategy.</p><p>This course is part of a <a href=""https://www.linkedin.com/learning/paths/devops-professional-certificate-by-pagerduty-and-linkedin?u=104"" target=""_blank"">Professional Certificate</a> from PagerDuty.</p>",Course,2024-02-23 16:34 UTC,N/A,true,N/A,
What Athletes Can Teach Us About Mental Health,"<p>Strong mental skills are foundational to an athlete's career—regardless of their sport. If you have great physical talent but can't manage your mental game effectively, you won't reach your full potential. And the better you manage your mind, the better you're perceived! In this course, performance psychologist Alex Auerbach, who works with the Toronto Raptors, shares practical wisdom to help athletes navigate their mental challenges and maintain high performance. He discusses how to think about performance and influence it positively. Alex also delves into cultivating presence and routine, connecting to motivation and purpose, understanding your ""why,” and dealing with imposter syndrome and failure. He also reveals strategies to maximize your potential and stay present every day. Finally, he shows how your team and environment can affect your performance.</p><p>
This course was created by Morra Aarons-Mele of <i>The Anxious Achiever</i>. We are pleased to offer this insightful discussion in our library.",Course,2024-10-10 21:52 UTC,N/A,false,N/A,
Git Essential Training (2023),"If you’ve ever wondered why someone should use Git or how to use it for version control, this is a great course to get started. Azure MVP and GitHub Star Barbara Forbes guides you through the installation process, the Git workflow, setting up and pushing code into a repo, and committing changes, all with a focus on version control and how Git can help you achieve it. Find out why people use Git. Learn how Git works, locally or through a provider, and how you can get it installed, configured, and running the way you need it to work. Follow the full process of pushing your code with Git, then explore ways to make changes to files. Discover important concepts in Git, like how to ignore files you don’t want to include, how branching can help you with development, what should be in a commit, and how to troubleshoot if you get into trouble. Plus, get current instruction on using GitHub Star and Microsoft MVP.",Course,2024-03-10 06:48 UTC,N/A,true,N/A,
Cloud Native Projects: AWS Serverless,"Developers need to understand how to use serverless functions in cloud environments. In this course, instructor Frank P Moley III explains how to use AWS Lambda as a serverless framework and why developers should understand how to use this tool. Frank introduces you to AWS Lambda and how to interact with Lambda in the AWS console. He talks about how and why serverless exists and operates as a technology selection, including its benefits, downfalls, and use cases. Frank covers how to use Lambda functions with Python, Java, and Go.",Course,2024-06-20 19:56 UTC,N/A,false,N/A,
Java Exception Handling,"As you build any application, you can’t just assume that everything will run as expected. There are so many things that could cause your applications to not function properly or even crash. This course aims to teach developers how to handle such unforeseen scenarios in applications. Join instructor Cecili Reid as she teaches you the different types of exceptions, how to handle exceptions, and how to test an application to ensure it handles exceptions as expected. Cecili uses a sample Spring Boot web app as a case study and walks through practical scenarios where you’d want to use exception handling in that application. She starts with an initial application that doesn’t have exception handling mechanisms, and as she walks through each concept, she shows you how to improve the application by applying the concepts taught in each chapter. Cecili also shares some best practices to follow when handling exceptions in your applications.",Course,2024-06-25 07:59 UTC,N/A,false,N/A,
UX Research Methods: Interviewing,"By taking the time to understand the needs and motivations of your users, you can develop better products that actually resonate with your target audience. In this course, learn the fundamentals of a core UX research method—interviewing—that can help you better understand the needs of your users.<br><br>
Amanda Stockwell explains what UX interviewing is, when UX professionals use interviews, and what kind of information you'll gather. She also takes you through how to prepare for interviews, moderate your sessions, and analyze your data.  After you wrap up this course, you'll be prepared to conduct UX interviews on your own.",Course,2024-06-18 12:31 UTC,N/A,false,N/A,
Practice Exam 1 for AWS Cloud Practitioner (CLF-C02),"<p>This practice exam is intended to help you prepare for the <b>AWS Cloud Practitioner (CLF-C02)</b> certification exam. After you launch the practice exam, there are three practice modes available; timed, untimed, or custom. Each mode allows unlimited attempts, explanations for correct and incorrect answers, and detailed exam results. The number and types of questions on the practice exam and the duration of the timed practice exam is intended to be representative of the certification exam.</p>
<p><b>Want more practice?</b> Additional practice exams for this certification are available and each has a unique question set for continued preparation.</p>
<ul>
<li><a href=""https://www.linkedin.com/learning/practice-exam-2-for-aws-cloud-practitioner-clf-c02/"" target=""_blank"">Practice Exam 2 for AWS Cloud Practitioner (CLF-C02)</a></li>
<li><a href=""https://www.linkedin.com/learning/practice-exam-3-for-aws-cloud-practitioner-clf-c02/"" target=""_blank"">Practice Exam 3 for AWS Cloud Practitioner (CLF-C02)</a></li>
<li><a href=""https://www.linkedin.com/learning/practice-exam-4-for-aws-cloud-practitioner-clf-c02"" target=""_blank"">Practice Exam 4 for AWS Cloud Practitioner (CLF-C02)</a></li>
</ul>
<p><b>About the certification</b>: To learn more about this certification, visit <b><a href=""https://aws.amazon.com/certification/certified-cloud-practitioner/"">Amazon Web Services</b></a>.</p>
<p><I>The practice exam questions provided are representative of the certification exam, but not the actual questions you will see on the certification exam. Practice exams are for self-assessment. Passing this practice exam does not guarantee that you will pass the actual certification exam.</I></p>",Course,2024-01-30 09:43 UTC,N/A,false,N/A,
Microsoft Azure Solutions Architect Expert (AZ-305) Cert Prep: 4 Design Infrastructure Solutions by Microsoft Press,"<p>Begin your preparations for the Microsoft Azure Solutions Architect Expert (AZ-305) Exam with this series of courses. In this final course, go over how to design infrastructure solutions. Explore compute options, such as using basic VMs, creating shared images, and setting up a load balancer. Learn how to use containers in Azure, including how to create a basic container, use Web Apps for containers, and use AKS. Go over application architectures, like setting up a modern API, using Azure Event Grid, and using Azure Service Bus. Learn about migrating to the cloud. Plus, dive into networking in Azure, with useful tips on network security options, connecting networks in Azure, using service endpoints, and more.</p>
 
<p>This course was created by Microsoft Press and Brett Hargreaves. We are pleased to host this training in our library.</p>",Course,2024-10-15 02:47 UTC,N/A,false,N/A,
Microsoft Azure Administrator (AZ-104) Cert Prep: 1 Manage Azure Identities and Governance,"<p>Cloud Skills are becoming an important part of any IT professional's resume. The Microsoft Azure Administrator Associate certification vets your skills and ability to create and manage workloads in the Microsoft Azure cloud. In this course, learn the core concepts and key skills you need to know to tackle the first domain of the Microsoft Azure Administrator (Exam AZ-104) certification exam. Learn how to manage Azure identities and governance like a pro, including user and guest accounts, bulk user updates, devices, passwords, resource hierarchies, role-based access control, and more. Upon completing this course, you’ll be equipped with the skills you need to prepare for the first domain of the exam.</p><p>This course was created by Microsoft Press. We are pleased to host this content in our library.</p>",Course,2024-04-06 00:52 UTC,N/A,false,N/A,
Skills to Build Stronger Work Relationships,"<p>In the world of hybrid work, uncertainty, and constant change, people need healthy work relationships to feel supported and show up as their best selves, This course teaches essential skills to build and maintain more resilient relationships.
Dr. Emily Anhalt teaches essential tools and skills, including: taking ownership of your part, strategies to build empathy, ways to create a more positive and safe working environment, ways to move from reactive to proactive, how to have healthy conflict, getting on the same team, expressing yourself more effectively, and breaking an emotional sweat every day.</p><p>This course is part of a <a href=""https://www.linkedin.com/learning/paths/becoming-a-manager-professional-certificate-by-linkedin-learning"" >Professional Certificate</a> from LinkedIn Learning.</p>",Course,2024-08-31 09:01 UTC,N/A,false,N/A,
"Build a Faster, More Structured Express API with Node.js and TypeScript","JavaScript is not going anywhere, but TypeScript is being used more and more in larger, production level projects. Being able to understand and use TypeScript in a backend environment will be useful for those who are interested in upgrading their largest JavaScript projects. In this course, software engineer Dakota Fabro teaches you how to: configure a project for TypeScript; configure a database connection for use with the API; build a seed file for the development process; build an Express server utilizing TypeScript; use Jest to test your API endpoints; host your API as a web service using Render; and write a proper README to explain and describe API routes for frontend developers.",Course,2024-02-27 10:05 UTC,2024-02-27 10:00 UTC,false,N/A,
CONTENT METADATA NO LONGER EXISTS - urn:li:lyndaCourse:2483198,CONTENT METADATA NO LONGER EXISTS - urn:li:lyndaCourse:2483198,Course,2023-04-10 19:32 UTC,N/A,true,N/A,
Nano Tips to Uncover Your Strengths with Shadé Zahrai,"<p>Welcome to our <i>Nano Tips</i> series, where LinkedIn Learning creators deliver impactful lessons in literally seconds. In this installment, explore the power of uncovering your inner strengths and managing your weaknesses to promote personal growth.</p><p>Join peak performance researcher and behavioral strategist Shadé Zahrai to learn the secrets of identifying and evolving your strengths with a genuinely curious, growth-focused mindset. Unearth your best possible self and start building on the innate qualities of your character, gathering feedback, unlocking your full potential, seeking balance, and finding your flow state. Along the way, Shadé shows you how to scrutinize your weaknesses to weed out bad habits, play to your strengths, and invest in your future self.</p>",Course,2025-06-30 07:23 UTC,N/A,false,N/A,
